{
  "schemaVersion": "1.1.0",
  "capturedAt": "2026-08-20T13:35:00Z",
  "subject": {
    "sliceId": "copilot-modernization-dotnet",
    "stack": "dotnet-sqlserver",
    "sourceCommit": "0000000000000000000000000000000000000000",
    "containerAppResourceId": "/subscriptions/00000000-0000-0000-0000-000000000000/resourceGroups/rg-mh-example/providers/Microsoft.App/containerApps/ca-mh-example",
    "revisionName": "ca-mh-example--release-000000000000",
    "imageDigest": "sha256:0000000000000000000000000000000000000000000000000000000000000000"
  },
  "workflow": {
    "file": ".github/workflows/catalog-dotnet.yml",
    "headSha": "1111111111111111111111111111111111111111",
    "handoffFile": "evidence/modernization-contract.json",
    "handoffSha256": "aa5a516be1fb353830a452a4500eb815b76b277fd64b0cce7afda88fce3ea7fd",
    "runId": "100001",
    "runAttempt": 1,
    "repository": "example/MicroHack-AppInnovation",
    "ref": "refs/heads/main",
    "event": "workflow_dispatch",
    "resultFile": "evidence/cicd/workflow-run.json",
    "jobs": {
      "staging": {
        "jobId": 200001,
        "environment": "staging",
        "federatedSubject": "repo:example/MicroHack-AppInnovation:environment:staging",
        "clientId": "00000000-0000-0000-0000-000000000003",
        "principalId": "00000000-0000-0000-0000-000000000004",
        "startedAt": "2026-08-20T12:30:00Z",
        "completedAt": "2026-08-20T12:50:00Z"
      },
      "production": {
        "jobId": 200002,
        "environment": "production",
        "federatedSubject": "repo:example/MicroHack-AppInnovation:environment:production",
        "clientId": "00000000-0000-0000-0000-000000000003",
        "principalId": "00000000-0000-0000-0000-000000000004",
        "startedAt": "2026-08-20T13:10:00Z",
        "completedAt": "2026-08-20T13:30:00Z"
      }
    }
  },
  "identity": {
    "authentication": "github-oidc",
    "identityKind": "user-assigned-managed-identity",
    "resourceId": "/subscriptions/00000000-0000-0000-0000-000000000000/resourceGroups/rg-mh-example/providers/Microsoft.ManagedIdentity/userAssignedIdentities/id-github",
    "clientId": "00000000-0000-0000-0000-000000000003",
    "principalId": "00000000-0000-0000-0000-000000000004",
    "stagingFederatedSubject": "repo:example/MicroHack-AppInnovation:environment:staging",
    "productionFederatedSubject": "repo:example/MicroHack-AppInnovation:environment:production",
    "federatedCredentialResourceIds": {
      "staging": "/subscriptions/00000000-0000-0000-0000-000000000000/resourceGroups/rg-mh-example/providers/Microsoft.ManagedIdentity/userAssignedIdentities/id-github/federatedIdentityCredentials/staging",
      "production": "/subscriptions/00000000-0000-0000-0000-000000000000/resourceGroups/rg-mh-example/providers/Microsoft.ManagedIdentity/userAssignedIdentities/id-github/federatedIdentityCredentials/production"
    },
    "acrRoleDefinitionId": "8311e382-0749-4cb8-b61a-304f252e45ec",
    "acrScope": "/subscriptions/00000000-0000-0000-0000-000000000000/resourceGroups/rg-mh-example/providers/Microsoft.ContainerRegistry/registries/acrexample",
    "containerAppRoleDefinitionId": "358470bc-b998-42bd-ab17-a7e34c199c0f",
    "containerAppScope": "/subscriptions/00000000-0000-0000-0000-000000000000/resourceGroups/rg-mh-example/providers/Microsoft.App/containerApps/ca-mh-example",
    "clientSecretUsed": false,
    "registryAdminUsed": false,
    "roleAssignmentEnumeration": {
      "assigneeObjectId": "00000000-0000-0000-0000-000000000004",
      "executionBoundary": "facilitator-session",
      "subscriptionId": "00000000-0000-0000-0000-000000000000",
      "requiredPermission": "Microsoft.Authorization/roleAssignments/read",
      "minimumBuiltInRole": "Reader",
      "command": "az role assignment list --all --include-inherited --assignee-object-id 00000000-0000-0000-0000-000000000004 --fill-principal-name false --fill-role-definition-name false --output json",
      "rawResultFile": "evidence/cicd/role-assignments.raw.json",
      "rawResultSha256": "0000000000000000000000000000000000000000000000000000000000000000",
      "performedAt": "2026-08-20T13:31:00Z",
      "all": true,
      "includeInherited": true,
      "fillPrincipalName": false,
      "fillRoleDefinitionName": false,
      "filtered": false
    },
    "resultFile": "evidence/cicd/identity.json"
  },
  "image": {
    "repository": "acrexample.azurecr.io/catalog-dotnet",
    "sourceCommit": "0000000000000000000000000000000000000000",
    "tag": "0000000000000000000000000000000000000000",
    "digest": "sha256:0000000000000000000000000000000000000000000000000000000000000000",
    "reference": "acrexample.azurecr.io/catalog-dotnet@sha256:0000000000000000000000000000000000000000000000000000000000000000",
    "resultFile": "evidence/cicd/build.json"
  },
  "revisions": {
    "mode": "multiple",
    "previous": "ca-mh-example--release-000000000000",
    "candidate": "ca-mh-example--ci-000000000000",
    "candidateLabel": "candidate",
    "candidateUrl": "https://ca-mh-example---candidate.example.azurecontainerapps.io",
    "resultFile": "evidence/cicd/candidate.json"
  },
  "smoke": {
    "healthStatus": 200,
    "readinessStatus": 200,
    "candidateUrl": "https://ca-mh-example---candidate.example.azurecontainerapps.io",
    "healthUrl": "https://ca-mh-example---candidate.example.azurecontainerapps.io/healthz",
    "readinessUrl": "https://ca-mh-example---candidate.example.azurecontainerapps.io/readyz",
    "testedBeforeApproval": true,
    "resultFile": "evidence/cicd/smoke.json"
  },
  "approval": {
    "environment": "production",
    "reviewer": "facilitator@example.invalid",
    "approvedAt": "2026-08-20T13:00:00Z",
    "resultFile": "evidence/cicd/approval.json"
  },
  "traffic": {
    "before": {
      "previous": 100,
      "candidate": 0,
      "observedAt": "2026-08-20T12:50:00Z",
      "source": "azure-container-app-revision-list",
      "rawResultFile": "evidence/cicd/before-revisions.raw.json",
      "rawResultSha256": "0000000000000000000000000000000000000000000000000000000000000000",
      "resultFile": "evidence/cicd/before.json"
    },
    "promotion": {
      "previous": 0,
      "candidate": 100,
      "observedAt": "2026-08-20T13:15:00Z",
      "source": "azure-container-app-revision-list",
      "rawResultFile": "evidence/cicd/promotion-revisions.raw.json",
      "rawResultSha256": "0000000000000000000000000000000000000000000000000000000000000000",
      "resultFile": "evidence/cicd/promotion.json"
    },
    "rollback": {
      "previous": 100,
      "candidate": 0,
      "observedAt": "2026-08-20T13:25:00Z",
      "source": "azure-container-app-revision-list",
      "rawResultFile": "evidence/cicd/rollback-revisions.raw.json",
      "rawResultSha256": "0000000000000000000000000000000000000000000000000000000000000000",
      "resultFile": "evidence/cicd/rollback.json"
    },
    "safety": {
      "mechanism": "shell-trap",
      "guardInstalledAt": "2026-08-20T13:11:00Z",
      "promotionAttemptedAt": "2026-08-20T13:14:00Z",
      "rollbackAttemptedAt": "2026-08-20T13:24:00Z",
      "rollbackCompletedAt": "2026-08-20T13:26:00Z",
      "executesOnFailure": true,
      "promotionSucceeded": true,
      "rollbackSucceeded": true,
      "resultFile": "evidence/cicd/rollback-safety.json"
    }
  },
  "assertions": {
    "immutableImage": true,
    "candidateHadZeroTraffic": true,
    "approvalPrecededPromotion": true,
    "promotionVerified": true,
    "rollbackVerified": true,
    "previousRevisionRetained": true,
    "sourceCommitCheckedOut": true,
    "roleAuditExternal": true,
    "revisionStateObserved": true,
    "rollbackGuardArmed": true
  }
}
